{"deck":{"id":"rlinf-robotwin-experiment-storyboard-revised","title":"RLinf 在 RoboTwin 上：增益成立，但归因受实验契约约束","purpose":"帮助具身智能与机器人学习研究者判断 RLinf 在 RoboTwin 上的性能与系统效率证据，并准确区分受控系统优势与纯算法因果结论。","audience":"具身智能、机器人学习与强化学习研究者、论文评审者和实验复现者。","language":"zh-CN","aspect_ratio":"16:9","communication_job":"By the end, embodied-AI researchers should be able to cite and reproduce RLinf’s RoboTwin result with the correct boundary because the experiments show a large cross-task train SSR gain and competitive execution times under fixed seeds, evaluation protocol, and 8-card A800 conditions, while implementation differences prevent isolating a pure RLinf algorithm effect.","talk_duration_minutes":12,"audience_profile":{"role":"具身智能与机器人学习研究者、论文评审者、实验复现者","prior_knowledge":"熟悉 VLA、SFT、GRPO、RoboTwin、SSR、OOD seed、多卡训练与基本实验对照方法。","cares_about":["RLinf 的性能增益是否跨任务成立","SFT→RL 的比较是否公平","reward、轨迹收集、精度和超参数差异是否改变结论","seed、GPU、评估温度和训练步数是否可复现","不同并行模式下 actor 与 rollout 的实际成本"],"likely_questions":["RLinf 的提升能否归因于 RL 信号本身？","8 个任务上的增益是否一致，训练成本是多少？","RLinf 与 SimpleVLA 的比较到底控制了哪些变量？","评估温度、模型初始化和 GPU 是否会改变 SSR？","实际运行时应该选择哪种并行模式？"],"desired_outcome":"能够复现实验契约，引用跨任务 train SSR 与系统效率结果，并将结论表述为受控条件下的 RLinf 完整训练系统优势，而非 OOD 泛化或无条件的纯算法优越性。"}},"narrative":{"arc":"实验问题 → 实验契约与结果范围 → RLinf 训练信号 → 与 SimpleVLA 的可比性边界 → 跨任务 train SSR → 框架级增益 → 敏感性边界 → 系统效率 → 受控条件下的结论","key_message":"在相同 RoboTwin 训练 seed、128 个 OOD 评估 seed、评估口径和 8 卡 A800 条件下，RLinf 的 RL 训练使 8 个任务的平均 train SSR 从 24.48% 提升到 84.63%，并在 colocated 配置下呈现有竞争力的 actor/rollout 时间；128 个 OOD seed 是评估契约，不是当前报告的 OOD SSR 结果。由于精度、超参数、valid trajectory 收集和 reward 设计不同，证据支持的是受控条件下的完整系统优势，而不是纯算法因果结论。","opening_question":"在固定 RoboTwin seed、评估口径和 8 卡 A800 条件下，RLinf 的提升能否归因于 RL 信号本身，还是只能归因于完整训练系统的差异？","closing_answer":"证据支持这样的结论：在固定实验契约下，RLinf 的 RL 训练带来跨 8 个任务的 train SSR 增益，并提供有竞争力的执行路径；128 个 OOD seed 只定义评估契约，当前证据未提供 OOD SSR 结果。由于精度、超参数、轨迹收集和 reward 设计并非完全同构，不能把结果表述为脱离实验契约的纯算法优越性。","sections":[{"id":"sec-1","title":"先锁定实验契约","job":"定义结果可比、可复现和可解释的边界","slide_ids":["s1","s2"]},{"id":"sec-2","title":"解释训练与对照","job":"说明 RLinf 的训练信号，并标出与 SimpleVLA 的关键差异","slide_ids":["s3","s4"]},{"id":"sec-3","title":"建立性能结论","job":"从跨任务 train SSR、框架比较和敏感性分析形成主结果判断","slide_ids":["s5","s6","s7"]},{"id":"sec-4","title":"落到系统与结论","job":"把性能证据连接到运行成本，并回答开场归因问题","slide_ids":["s8","s9"]}],"priority_map":{"core":["s3","s4","s5","s6","s7","s8","s9"],"support":["s2"],"context":["s1"]},"logic_check":{"opening_resolved":true,"core_has_evidence":true,"no_redundant_slides":true,"rationale":"已保留 9 页与原叙事顺序，并将 128 个 OOD seed 明确限定为评估契约；s5 与 s9 的主结果统一显式标注 train SSR，且结论明确当前未报告 OOD SSR。"}},"visual":{"style_family":"academic-evidence","image_policy":"仅使用证据索引中的源表、源图或页面快照；优先使用原生表格、原生图表与可追溯机制图，禁止装饰性图片。","density_profile":"中等密度、证据优先；核心结果使用大图表或大表格，实验边界使用短注释和明确的证据标记。","style_reason":"受众关心可比性、复现性和归因边界，因此采用暖白画布、深蓝标题、珊瑚强调和源证据板的学术证据风格。","layout_system":"Codex Grid evidence-first：统一左对齐标题与宽边距，交替使用证据表、机制流程、结果图表、对照构图和结论边界。","style_reference":"codex/theme-reference.png"},"plan":{"title":"RLinf 在 RoboTwin 上：增益成立，但归因受实验契约约束","subtitle":"先确认比较口径，再判断 train SSR、效率与结论边界","slides":[{"id":"s1","layout":"title","composition_id":"thesis-stage","role":"title","content_priority":"context","action_title":"RLinf 的增益成立，但归因受实验契约约束","audience_question":"这组实验最终要让我判断什么？","narrative_job":"提出唯一主问题：如何在性能增益与归因边界之间做出严谨判断。","slide_goal":"让观众带着明确的归因问题进入实验契约、结果和系统效率证据。","primary_claim":"RLinf 的实验结论必须同时回答性能是否提升、运行是否有效率，以及提升能否被归因于 RL 信号本身。","evidence":[],"implication":"后续每页都围绕可比性、跨任务 train SSR、系统成本和外推边界展开。","transition_in":"从观众熟悉的“看最终 SSR”切入，提出更严格的归因问题。","transition_out":"要判断增益属于什么，先必须固定实验在什么条件下发生。","evidence_refs":[],"table_refs":[],"asset_candidates":[],"visual_intent":"text_led","visual_plan":{"layout_family":"title","primary_visual":null,"image_budget":0,"image_roles":[],"data_strategy":"none","background_variant":"quiet","density":"sparse"},"speaker_notes":{"talk_track":"我们通常先看最终 SSR，但这组实验真正需要回答的是：增益来自 RL 信号本身，还是来自一整套训练系统？今天沿着三个问题展开：train SSR 是否跨任务提升，运行是否具有效率，以及哪些实验条件限制归因。先把实验契约锁定，再看训练机制、结果和系统成本，最后给出可复现、但不越界的结论。","delivery_cue":"先读出标题中的“增益成立”和“归因受约束”，随后明确三个判断维度。","source_refs":[],"estimated_seconds":65},"content":{"eyebrow":"RoboTwin 实验解读","title":"RLinf 的增益成立，但归因受实验契约约束","subtitle":"性能、效率与归因边界必须一起判断","kicker":null,"lede":null,"note":{"label":"判断框架","value":"性能提升 ≠ RL 单独贡献"},"body_points":[],"metrics":[],"steps":[],"result":null,"columns":[],"takeaway":null}},{"id":"s2","layout":"evidence","composition_id":"image-thesis-split","role":"problem","content_priority":"support","action_title":"先锁定实验契约，再谈 train SSR","audience_question":"哪些条件决定这组结果能否复现和外推？","narrative_job":"合并实验契约与结果范围，明确训练 seed、OOD seed、机器人、领域随机化、GPU 条件及其复现限制。","slide_goal":"把后续所有数字锁定在明确的实验边界内。","primary_claim":"SFT 与 RL 使用同一组 1,000 个 RoboTwin 随机 seed，评估使用额外 128 个未见 seed，并统一在 8 卡 A800 平台上运行；128 个 OOD seed 是评估契约，不是当前报告的 OOD SSR 结果。","evidence":[{"claim_support":"训练阶段使用 1,000 个随机场景 seed，评估阶段额外使用 128 个未参与训练的 OOD seed，并采用双臂 Piper 机械臂。","evidence_ref":"p1-snapshot","interpretation":"128 个 OOD seed 规定了评估设置，但证据索引中的主结果表报告的是 train SSR，不能将该协议数字当作 OOD 性能结果。"},{"claim_support":"RoboTwin 使用领域随机化；相同 seed 集合在不同 Python、系统和硬件环境下可能无法完全复现，且观察到 H100 与 A800 的初始 SSR 差异。","evidence_ref":"p1-snapshot","interpretation":"复现时必须把运行环境和 GPU 视为实验变量。"}],"implication":"后续结果的有效范围是固定 RoboTwin 配置、seed、评估口径和 8 卡 A800；当前计划不声称已证明 OOD SSR 泛化。","transition_in":"开场的归因问题首先需要一个稳定、可复现的比较边界。","transition_out":"边界确定后，还要看 RLinf 如何把 rollout 轨迹转换为更新信号。","evidence_refs":["p1-snapshot"],"table_refs":[],"asset_candidates":["p1-snapshot"],"visual_intent":"source_figure","visual_plan":{"layout_family":"evidence","primary_visual":"p1-snapshot","image_budget":1,"image_roles":["evidence"],"data_strategy":"native_table","background_variant":"light","density":"balanced"},"speaker_notes":{"talk_track":"先把比较边界锁定。SFT 与 RL 共用 1,000 个 RoboTwin 随机 seed，使用双臂 Piper；评估再加入 128 个未见 seed。这里必须区分协议与结果：128 个 OOD seed 定义了评估契约，但当前主结果表呈现的是 train SSR，并没有提供 OOD SSR 数字。背景、杂乱度、光照、桌高和语言都会变化，运行环境与 GPU 也会影响复现，所以后面的结果只在固定契约内解释。","delivery_cue":"依次强调 1,000、128 和 8 卡三个契约指标，并明确 OOD seed 不是 OOD SSR 结果。","source_refs":["p1-snapshot"],"estimated_seconds":75},"content":{"eyebrow":"实验契约","title":"先锁定实验契约，再谈 train SSR","subtitle":null,"kicker":null,"lede":"128 个 OOD seed 是评估契约；当前主结果报告的是 train SSR，不是 OOD SSR。","note":{"label":"契约说明","value":"1,000 个共同训练 seed；128 个未见 OOD seed；双臂 Piper；统一 8 卡 A800。"},"body_points":[{"label":"训练对齐","text":"SFT 与 RL 共用 1,000 个随机场景 seed，并采用双臂 Piper 机械臂。"},{"label":"OOD 口径","text":"额外使用 128 个未见 seed 作为评估契约；证据索引未提供对应 OOD SSR 主结果。"},{"label":"复现边界","text":"领域随机化与运行环境会改变可用 seed 和初始 SSR，因此统一锁定 8 卡 A800。"}],"metrics":[{"label":"训练 seed","value":"1,000","meaning":"SFT 与 RL 的共同场景起点"},{"label":"OOD 评估 seed","value":"128","meaning":"评估契约，不等于已报告的 OOD SSR 结果"},{"label":"硬件条件","value":"8× A800","meaning":"后续 train SSR 比较的固定平台"}],"steps":[],"result":null,"columns":[],"takeaway":{"label":"实验契约","value":"后续主结果统一标注为 train SSR；128 个 OOD seed 不承担性能结果含义。"}}},{"id":"s3","layout":"pipeline","composition_id":"causal-flow","role":"method_detail","content_priority":"core","action_title":"RLinf 的训练信号来自一条完整链路","audience_question":"RLinf 的训练信号究竟如何产生？","narrative_job":"解释 rollout、valid trajectory、action-level reward、GRPO 优势估计和 LoRA 更新之间的关系。","slide_goal":"让观众知道结果背后的训练配方。","primary_claim":"RLinf 的配置将 128×8 的 rollout 组织为 global batch size 1024，使用 group size 8、action-level reward、token-level logprob/entropy、GRPO 和 LoRA 更新。","evidence":[{"claim_support":"配置给出 rollout batch 128×8=1024、global batch size 1024、group_size 8、reward_type action_level、logprob_type token_level、adv_type grpo、is_lora true 和 learning rate 2.0e-4。","evidence_ref":"p4-snapshot","interpretation":"这些配置共同决定训练信号与参数更新方式。"}],"implication":"性能结果应归因于完整训练路径，而不应只归因于算法名称。","transition_in":"实验契约说明了测什么，训练配置说明了 RLinf 如何学习。","transition_out":"接下来必须检查这套路径与 SimpleVLA 是否真的只差一个框架名称。","evidence_refs":["p4-snapshot"],"table_refs":[],"asset_candidates":[],"visual_intent":"method_diagram","visual_plan":{"layout_family":"pipeline","primary_visual":null,"image_budget":0,"image_roles":[],"data_strategy":"diagram","background_variant":"default","density":"balanced"},"speaker_notes":{"talk_track":"实验契约说明评价什么，这一页补上 RLinf 如何学习。一次更新先按 128×8 组织出 1,024 条 rollout，并以 group size 8 形成比较单元；奖励落在 action level，logprob 与 entropy 保持 token level，再用 GRPO 计算优势并更新 actor。最后通过 LoRA 和 2.0e-4 学习率限定更新方式。配置说明的是完整训练配方，下一页继续核对它与 SimpleVLA 的差异。","delivery_cue":"沿五个节点从左到右阅读，最后停在 LoRA 更新。","source_refs":["p4-snapshot"],"estimated_seconds":100},"content":{"eyebrow":"训练机制","title":"RLinf 的训练信号来自一条完整链路","subtitle":null,"kicker":null,"lede":"训练信号由采样规模、奖励粒度、优势估计和参数更新共同决定。","note":null,"body_points":[],"metrics":[{"label":"每轮 rollout","value":"128 × 8","meaning":"一次更新组织 1024 条轨迹"},{"label":"奖励粒度","value":"action-level","meaning":"奖励绑定到动作"},{"label":"更新方式","value":"GRPO + LoRA","meaning":"用组内优势估计驱动参数高效更新"}],"steps":[{"title":"Rollout 采样","text":"并行生成一轮轨迹。","metric":"128 × 8 = 1024","tone":"navy"},{"title":"Group 组织","text":"按 group size 8 形成比较单元。","metric":"group size = 8","tone":"blue"},{"title":"Action-level reward","text":"把任务反馈落到动作粒度。","metric":"reward_type = action_level","tone":"coral"},{"title":"GRPO 优势估计","text":"计算用于 actor 更新的优势信号。","metric":"adv_type = grpo","tone":"blue"},{"title":"LoRA 更新","text":"在参数高效更新范围内优化策略。","metric":"is_lora = true · lr = 2.0e-4","tone":"navy"}],"result":{"label":"训练配方的含义","value":"性能归因应落在 rollout、reward、优化与参数更新的完整路径上"},"columns":[],"takeaway":null}},{"id":"s4","layout":"comparison","composition_id":"evidence-table","role":"limitations","content_priority":"core","action_title":"共享基础，但不是同构训练","audience_question":"两套实现到底控制了哪些变量？","narrative_job":"并列呈现共同基础与关键差异，阻止把框架比较误读为纯算法消融。","slide_goal":"建立正确的因果解释边界。","primary_claim":"两套方法共享 SFT 模型、train/eval seeds、模型实现和 GRPO，但在精度、rollout batch、学习率、LoRA、valid trajectory 收集和 reward 粒度上存在差异。","evidence":[{"claim_support":"对比表列出 RLinf 使用 bf16、rollout batch 1024、learning rate 2.0e-4、LoRA，而 SimpleVLA 使用混合精度、rollout batch 512、learning rate 5e-6 和全参数训练。","evidence_ref":"p4-table-1-crop","interpretation":"变量差异会改变训练动态。"},{"claim_support":"RLinf 固定轮次后过滤 collected traject